{
  "animation": {
    "duration": 4,
    "loop": false,
    "markers": [],
    "properties": [
      "geometry.x",
      "geometry.y",
      "opacity",
      "settings.stroke",
      "transform.scaleX",
      "transform.scaleY",
      "transform.translateX",
      "transform.translateY",
      "settings.color.gradient.x1",
      "settings.color.gradient.x2",
      "settings.color.gradient.y1",
      "settings.color.gradient.y2"
    ],
    "targets": [
      "6ajj9fjng",
      "dsnbt7bxt",
      "ez1xp5nv5",
      "k5yv9nojm",
      "tfcr0zcic"
    ],
    "tracks": [
      {
        "kind": "number",
        "property": 0,
        "segmentModes": [
          "linear",
          "linear",
          "linear"
        ],
        "target": 0,
        "temporalCoefficients": [
          0,
          0,
          0,
          0,
          0,
          0,
          0,
          0,
          0,
          0,
          0,
          0,
          0,
          0,
          0,
          0,
          0,
          0,
          0,
          0,
          0,
          0,
          0,
          0
        ],
        "times": [
          1.45,
          2.27,
          2.55,
          3.35
        ],
        "values": [
          234.96,
          234.96,
          242.76,
          242.76
        ]
      },
      {
        "kind": "number",
        "property": 1,
        "segmentModes": [
          "linear",
          "linear",
          "linear"
        ],
        "target": 0,
        "temporalCoefficients": [
          0,
          0,
          0,
          0,
          0,
          0,
          0,
          0,
          0,
          0,
          0,
          0,
          0,
          0,
          0,
          0,
          0,
          0,
          0,
          0,
          0,
          0,
          0,
          0
        ],
        "times": [
          1.45,
          2.27,
          2.55,
          3.35
        ],
        "values": [
          291.07,
          291.07,
          160.77,
          160.77
        ]
      },
      {
        "kind": "number",
        "property": 2,
        "segmentModes": [
          "linear",
          "linear",
          "linear",
          "linear",
          "linear"
        ],
        "target": 0,
        "temporalCoefficients": [
          0,
          0,
          0,
          0,
          0,
          0,
          0,
          0,
          0,
          0,
          0,
          0,
          0,
          0,
          0,
          0,
          0,
          0,
          0,
          0,
          0,
          0,
          0,
          0,
          0,
          0,
          0,
          0,
          0,
          0,
          0,
          0,
          0,
          0,
          0,
          0,
          0,
          0,
          0,
          0
        ],
        "times": [
          0.7,
          0.73,
          2.18,
          2.22,
          2.6,
          2.63
        ],
        "values": [
          0,
          1,
          1,
          0,
          0,
          1
        ]
      },
      {
        "interpolationSpaces": [
          "rgb",
          "rgb",
          "rgb",
          "rgb",
          "rgb"
        ],
        "kind": "color",
        "property": 3,
        "segmentModes": [
          "linear",
          "linear",
          "linear",
          "linear",
          "linear"
        ],
        "target": 0,
        "times": [
          0.7,
          0.73,
          2.18,
          2.22,
          2.6,
          2.63
        ],
        "values": [
          3455187200,
          3455187455,
          3455187455,
          3455187200,
          3455187200,
          3455187455
        ]
      },
      {
        "kind": "number",
        "property": 4,
        "segmentModes": [
          "temporal",
          "temporal",
          "temporal",
          "temporal",
          "temporal"
        ],
        "target": 0,
        "temporalCoefficients": [
          0.724212734652,
          0.00571562992,
          0.020071635428,
          0.7,
          -1.695567472273,
          2.595429736317,
          0.000137735956,
          0.1,
          0.734513066447,
          -2.215079577667,
          2.25056651122,
          1.45,
          1.905897413112,
          -2.912388946588,
          0.106491533476,
          1,
          0,
          0,
          0.38,
          2.22,
          -0.009427900428,
          0.018855800855,
          -0.009427900428,
          0.1,
          0.463496150178,
          0.003658003149,
          0.012845846674,
          2.6,
          -4.826342420549,
          7.226254269537,
          0.000088151012,
          0.1,
          0.470763226267,
          -0.324672909642,
          0.513909683375,
          3.08,
          0.438311068691,
          -0.660414385728,
          -0.009628840421,
          2.5
        ],
        "times": [
          0.7,
          1.45,
          2.22,
          2.6,
          3.08,
          3.74
        ],
        "values": [
          0.1,
          1,
          0.1,
          0.1,
          2.5,
          2.268267842542
        ]
      },
      {
        "kind": "number",
        "property": 5,
        "segmentModes": [
          "temporal",
          "temporal",
          "temporal",
          "temporal",
          "temporal"
        ],
        "target": 0,
        "temporalCoefficients": [
          0.724212734652,
          0.00571562992,
          0.020071635428,
          0.7,
          -1.695567472273,
          2.595429736317,
          0.000137735956,
          0.1,
          0.734513066447,
          -2.215079577667,
          2.25056651122,
          1.45,
          1.905897413112,
          -2.912388946588,
          0.106491533476,
          1,
          0,
          0,
          0.38,
          2.22,
          -0.009427900428,
          0.018855800855,
          -0.009427900428,
          0.1,
          0.463496150178,
          0.003658003149,
          0.012845846674,
          2.6,
          -4.826342420549,
          7.226254269537,
          0.000088151012,
          0.1,
          0.470763226267,
          -0.324672909642,
          0.513909683375,
          3.08,
          0.438311068691,
          -0.660414385728,
          -0.009628840421,
          2.5
        ],
        "times": [
          0.7,
          1.45,
          2.22,
          2.6,
          3.08,
          3.74
        ],
        "values": [
          0.1,
          1,
          0.1,
          0.1,
          2.5,
          2.268267842542
        ]
      },
      {
        "kind": "number",
        "property": 6,
        "segmentModes": [
          "linear",
          "temporal",
          "temporal"
        ],
        "target": 0,
        "temporalCoefficients": [
          0,
          0,
          0,
          0,
          0,
          0,
          0,
          0,
          0,
          0,
          0.38,
          2.22,
          74.523444602097,
          -74.523444602097,
          -98.87,
          69.04,
          0.878130744485,
          -0.249368106618,
          0.491237362132,
          2.6,
          -161.378969509124,
          255.611295833025,
          -31.473520133355,
          -29.83
        ],
        "times": [
          0.7,
          2.22,
          2.6,
          3.72
        ],
        "values": [
          -29.83,
          69.04,
          -29.83,
          32.928806190545
        ]
      },
      {
        "kind": "number",
        "property": 7,
        "segmentModes": [
          "linear",
          "temporal",
          "temporal"
        ],
        "target": 0,
        "temporalCoefficients": [
          0,
          0,
          0,
          0,
          0,
          0,
          0,
          0,
          0,
          0,
          0.38,
          2.22,
          126.460143529191,
          -126.460143529191,
          -142.17,
          113.34,
          0.874626608456,
          -0.214642693015,
          0.460016084559,
          2.6,
          -205.217611955029,
          320.034878682706,
          -19.017859638639,
          -28.83
        ],
        "times": [
          0.7,
          2.22,
          2.6,
          3.72
        ],
        "values": [
          -28.83,
          113.34,
          -28.83,
          66.969407089038
        ]
      },
      {
        "kind": "number",
        "property": 6,
        "segmentModes": [],
        "target": 1,
        "temporalCoefficients": [],
        "times": [
          3.9632
        ],
        "values": [
          -54.42
        ]
      },
      {
        "kind": "number",
        "property": 0,
        "segmentModes": [
          "linear",
          "linear",
          "linear"
        ],
        "target": 2,
        "temporalCoefficients": [
          0,
          0,
          0,
          0,
          0,
          0,
          0,
          0,
          0,
          0,
          0,
          0,
          0,
          0,
          0,
          0,
          0,
          0,
          0,
          0,
          0,
          0,
          0,
          0
        ],
        "times": [
          1.22,
          2.0674,
          2.09,
          2.85
        ],
        "values": [
          247.93,
          247.93,
          337.76,
          337.76
        ]
      },
      {
        "kind": "number",
        "property": 1,
        "segmentModes": [
          "linear",
          "linear",
          "linear"
        ],
        "target": 2,
        "temporalCoefficients": [
          0,
          0,
          0,
          0,
          0,
          0,
          0,
          0,
          0,
          0,
          0,
          0,
          0,
          0,
          0,
          0,
          0,
          0,
          0,
          0,
          0,
          0,
          0,
          0
        ],
        "times": [
          1.22,
          2.0674,
          2.09,
          2.85
        ],
        "values": [
          176.5,
          176.5,
          144.88,